Name,Price,Rating,Reviews,Category,Region,Type,ABV,IBU,Tasting_Notes,Food_Pairing,Suggested_Glassware,Suggested_Serving_Temperature (F),Calories Per Serving (12 Oz),Carbs Per Serving (12 Oz),Features
Prost Pilsner,10.99,4.7,2.0,Pilsner,United States,"Craft, Independent Craft Brewer",4.9,35.0,"Bright, Crisp, Floral, Grassy",Unknown,Pilsner Glass,45.0,150.0,8.0,None
Austin Eastciders Pineapple Cider,10.99,4.8,11.0,Cider,United States,"Craft, Independent Craft Brewer",5.0,1.0,"Apple, Dry, Fresh, Tropical Fruit","Cheese - Fresh & Soft, Salads & Greens","Pint Glass, Snifter/Goblet/Chalice",50.0,130.0,8.0,"Gluten Reduced, Kosher"
Jack's Abby Post Shift Pilsner,10.99,4.8,3.0,Pilsner,United States,"Craft, Independent Craft Brewer",4.7,30.0,"Balanced, Biscuit, Bright, Crisp, Dry, Grainy, Light, Minerality","Cheese - Blue, Cheese - Stinky, Nuts, Pasta, Pork, Shellfish",Pilsner Glass,45.0,130.0,8.0,None
Singlecut 18 Watt IPA,23.0,4.8,4.0,Session IPA,United States,Craft,5.0,82.0,No special notesbeer_updated,Unknown,Pint Glass,50.0,130.0,8.0,None
White Claw Hard Seltzer Surge Blackberry,2.75,4.4,2.0,Hard Seltzer,United States,Craft,8.0,35.0,"Berry, Crisp, Sweet, Tart",Unknown,Snifter/Goblet/Chalice,45.0,130.0,8.0,Gluten Reduced
Smirnoff Ice Watermelon Mimosa,10.44,4.5,11.0,Malt Liquor,United States,Craft,5.8,35.0,"Flavored, Watermelon, Sweet, Acidic",Nuts,Pint Glass,40.0,130.0,8.0,None
Lone River Spicy Ranch Water,10.99,4.7,5.0,Hard Seltzer,United States,Craft,4.0,35.0,No special notesbeer_updated,Unknown,Snifter/Goblet/Chalice,45.0,80.0,3.0,None
Spaten Premium Lager,11.99,4.5,5.0,Helles Lager,Germany,Craft,5.2,21.0,"Bitter, Grainy, Bready","Cured Meats, Fish - Meaty & Oily","Pint Glass, Stein/Pub Mug",45.0,130.0,8.0,None
Lone Pint Yellow Rose Smash IPA,12.62,5.0,3.0,IPA,United States,Craft,6.8,62.0,No special notesbeer_updated,Unknown,"Pint Glass, Snifter/Goblet/Chalice",50.0,130.0,8.0,None
Cisco Brewers Beach Box Variety Pack,18.99,4.8,1.0,Variety Pack Beer,United States,Variety Pack,5.5,35.0,"Citrus, Crisp, Fresh, Grapefruit, Light","Beef, Chicken, Fish - Meaty & Oily, Fish - White",Unknown,49.0,130.0,8.0,None
Kona Spiked Island Seltzer Variety,19.49,4.7,9.0,Hard Seltzer,United States,Variety Pack,4.2,35.0,No special notesbeer_updated,Unknown,Snifter/Goblet/Chalice,45.0,100.0,8.0,Gluten Reduced
Corona Hard Seltzer Seltzerita Variety Pack Gluten Free Spiked Sparkling Water,19.99,4.6,1.0,Hard Seltzer,Mexico,Variety Pack,6.0,35.0,No special notesbeer_updated,Unknown,Snifter/Goblet/Chalice,45.0,90.0,3.0,Gluten-Free
Four Loko Strawberry Lemonade,3.29,4.3,7.0,Hard Lemonade,United States,Craft,12.0,35.0,No special notesbeer_updated,Unknown,Unknown,49.0,130.0,8.0,None
Trumer Pils,10.99,4.8,6.0,Pilsner,Austria,Craft,4.9,26.0,"Crisp, Dry, Grainy, Biscuit","Nuts, Root Vegetables",Pilsner Glass,45.0,130.0,8.0,None
Deschutes Fresh Haze IPA,12.5,4.6,11.0,New England / Hazy IPA,United States,Craft,6.5,45.0,No special notesbeer_updated,Unknown,"Pint Glass, Snifter/Goblet/Chalice",50.0,130.0,8.0,None
Karbach Ranch Water Hard Seltzer Variety,19.49,4.4,3.0,Hard Seltzer,United States,"Craft, Variety Pack",4.5,35.0,No special notesbeer_updated,Unknown,Snifter/Goblet/Chalice,45.0,90.0,1.0,Gluten-Free
Citizen Cider Unified Press,8.99,4.9,3.0,Cider,United States,"Craft, Independent Craft Brewer",5.2,35.0,"Apple, Balanced, Crisp, Silky, Smooth","Cheese - Blue, Cheese - Creamy & Bloomy, Cheese - Fresh & Soft, Cheese - Hard Aged, Cheese - Nutty & Semi-Firm, Pork","Pint Glass, Snifter/Goblet/Chalice",50.0,146.0,12.0,Gluten-Free
Four Loko Peach,3.39,4.5,1.0,Malt Liquor,United States,Craft,12.0,35.0,No special notesbeer_updated,Unknown,Pint Glass,40.0,130.0,8.0,None
Citizen Cider The Lake Hopper,4.25,4.9,4.0,Cider,United States,"Craft, Independent Craft Brewer",6.2,15.0,"Apple, Hoppy, Dry","Cured Meats, Pork","Pint Glass, Snifter/Goblet/Chalice",50.0,130.0,8.0,Gluten-Free
Seagram's Escapes Calypso Colada,5.99,4.7,9.0,Malt Liquor,United States,Craft,3.2,35.0,No special notesbeer_updated,Unknown,Pint Glass,40.0,130.0,8.0,None
Downeast Seasonal Cider - Pineapple,11.99,4.4,19.0,Cider,United States,"Craft, Independent Craft Brewer, Seasonal",5.1,35.0,"Apple, Sweet, Tropical, Tropical Fruit","Cheese - Fresh & Soft, Fish - White","Pint Glass, Snifter/Goblet/Chalice",50.0,130.0,8.0,Gluten Reduced
Carlsberg Elephant Strong,12.98,4.7,6.0,Pilsner,Denmark,Craft,7.2,28.0,"Balanced, Bitter, Caramel, Hoppy, Malty, Smooth, Strong","Beef, Cured Meats","Pint Glass, Stein/Pub Mug, Snifter/Goblet/Chalice",55.0,130.0,8.0,None
SweetWater IPA,10.99,4.8,4.0,IPA,United States,Craft,6.3,50.0,"Hoppy, Pine, Grapefruit, Dry","Cured Meats, Salads & Greens","Pint Glass, Snifter/Goblet/Chalice",50.0,130.0,8.0,None
Dogfish Head 120 Minute IPA,11.37,4.8,12.0,Imperial / Double IPA,United States,Craft,17.5,120.0,"Strong, Syrupy, Dried Fruit, Malty","Dessert - Fruit, Pork",Snifter/Goblet/Chalice,55.0,130.0,8.0,None
Community Beer Co. Mosaic IPA,12.99,4.9,4.0,IPA,United States,Independent Craft Brewer,8.6,85.0,"Malty, Hoppy, Fruity, Tropical Fruit","Cured Meats, Nuts","Pint Glass, Snifter/Goblet/Chalice",50.0,130.0,8.0,None
Redd's Wicked Apple Ale,3.69,4.4,2.0,Fruit Beer,United States,Craft,8.0,35.0,No special notesbeer_updated,Unknown,"Pint Glass, Snifter/Goblet/Chalice",50.0,130.0,8.0,None
Four Loko Sour Grape,3.69,4.6,1.0,Malt Liquor,United States,Craft,14.0,35.0,No special notesbeer_updated,Unknown,Pint Glass,40.0,130.0,8.0,None
Fremont Lush IPA,13.49,4.8,1.0,IPA,United States,Craft,7.0,80.0,No special notesbeer_updated,Unknown,"Pint Glass, Snifter/Goblet/Chalice",50.0,130.0,8.0,None
Coney Island Mermaid Pilsner Beer,13.79,4.5,5.0,Pilsner,United States,Independent Craft Brewer,5.2,30.0,"Light, Crisp, Biscuit","Nuts, Beef",Pilsner Glass,45.0,130.0,8.0,None
Bent Water Sluice Juice New England IPA,14.99,4.7,7.0,New England / Hazy IPA,United States,"Craft, Independent Craft Brewer",6.5,35.0,No special notesbeer_updated,Unknown,"Pint Glass, Snifter/Goblet/Chalice",50.0,130.0,8.0,None
Tsingtao,20.59,4.8,8.0,Light Lager,China,Craft,4.8,25.0,"Dry, Grainy, Light, Malty","Duck & Game Bird, Chicken",Pint Glass,40.0,157.0,12.0,None
"Founders All Day Haze, Session Hazy IPA Beer",18.99,3.8,4.0,Session IPA,United States,"Craft, Seasonal",4.9,35.0,"Bright, Floral, Fruity, Guava, Nectarine, Peach, Pineapple, Tropical, Yeasty","Cheese - Fresh & Soft, Chicken, Dessert - Chocolate & Coffee, Dessert - Fruit, Fish - White, Fruit - Citrus, Nuts, Pork, Salads & Greens, Shellfish, Tomatoes, Turkey",Pilsner Glass,45.0,150.0,11.2,None
Cayman Jack Moscow Mule,10.99,4.6,9.0,Malt Liquor,United States,Craft,5.8,35.0,Citrus,Chicken,Pint Glass,40.0,130.0,8.0,None
Sol Cerveza Mexican Import Lager Beer,10.49,4.8,7.0,American-Style Lager,Mexico,Craft,4.5,35.0,"Light, Crisp, Grainy","Nuts, Shellfish",Pint Glass,40.0,130.0,8.0,None
Wiseacre Ananda IPA,10.99,4.9,2.0,IPA,United States,Craft,6.2,75.0,No special notesbeer_updated,Unknown,"Pint Glass, Snifter/Goblet/Chalice",50.0,130.0,8.0,None
Stowe High and Dry Hard Cider,13.99,4.8,4.0,Cider,United States,Craft,6.5,35.0,No special notesbeer_updated,Unknown,"Pint Glass, Snifter/Goblet/Chalice",50.0,130.0,8.0,Gluten Reduced
Left Hand Peanut Butter Milk Stout,13.99,4.7,5.0,Milk Stout,United States,"Craft, Independent Craft Brewer",6.0,25.0,"Chocolate, Coffee, Creamy, Flavored, Malty, Mocha, Rich, Roasted, Smooth, Toasty",Unknown,Pint Glass,50.0,130.0,8.0,None
"Cape May Brewing Co., Cape May White (Belgian-Style Wheat Ale)",13.99,4.7,2.0,Witbier,United States,Craft,5.2,11.0,Citrus,"Fish - Meaty & Oily, Fish - White, Fruit - Citrus",Snifter/Goblet/Chalice,50.0,130.0,8.0,None
Oskar Blues Double Dale's Imperial IPA,32.49,4.7,1.0,Imperial / Double IPA,United States,Craft,9.0,35.0,No special notesbeer_updated,Unknown,Snifter/Goblet/Chalice,50.0,130.0,8.0,None
TRULY Hard Seltzer Classic Lime Margarita Style,11.99,4.4,2.0,Hard Seltzer,United States,Craft,5.3,35.0,"Citrus, Crisp, Salty, Sour, Sweet",Unknown,Snifter/Goblet/Chalice,45.0,130.0,8.0,Gluten-Free
Revolution Hazy Hero IPA,10.99,4.6,3.0,New England / Hazy IPA,United States,"Craft, Independent Craft Brewer, Seasonal",7.3,50.0,"Citrus, Fruity, Hoppy, Smooth",Unknown,"Pint Glass, Snifter/Goblet/Chalice",50.0,130.0,8.0,None
Beer'd Dogs & Boats,17.59,4.9,1.0,Imperial / Double IPA,United States,Craft,9.1,67.0,No special notesbeer_updated,Unknown,Snifter/Goblet/Chalice,55.0,130.0,8.0,None
Sixpoint Sweet Action,9.99,4.6,4.0,Cream Ale,United States,"Craft, Independent Craft Brewer",5.0,40.0,"Apricot, Biscuit, Caramel, Citrus, Floral, Stone Fruit","Cheese - Fresh & Soft, Dessert - Vanilla & Caramel, Pork, Root Vegetables, Shellfish",Pint Glass,50.0,130.0,8.0,None
Other Half Double Dry Hopped Green City IPA,18.99,4.4,1.0,IPA,United States,"Craft, Independent Craft Brewer",7.0,35.0,No special notesbeer_updated,Unknown,Snifter/Goblet/Chalice,50.0,130.0,8.0,None
Sierra Nevada Seasonal Oktoberfest,0.0,3.0,1.0,Marzen / Oktoberfest,Unknown,"""+"" Seasonal",5.5,19.0,No special notesbeer_updated,Unknown,Unknown,49.0,130.0,8.0,None
Mike's Hard Lemonade Seasonal Pick,10.49,4.3,14.0,Hard Lemonade,United States,Seasonal,5.0,35.0,No special notesbeer_updated,Unknown,"Pint Glass, Mason Jar",45.0,130.0,8.0,Gluten Reduced
Night Shift Weisse Fruited Sour Series,12.54,4.6,6.0,Berliner Weisse,United States,"Craft, Independent Craft Brewer",5.2,35.0,"Berry, Fruity, Funky, Sour","Cheese - Fresh & Soft, Dessert - Fruit, Dessert - Vanilla & Caramel, Salads & Greens",Snifter/Goblet/Chalice,50.0,130.0,8.0,None
The Alchemist Focal Banger IPA,6.6,4.8,2.0,IPA,United States,Craft,7.0,90.0,No special notesbeer_updated,Unknown,"Pint Glass, Snifter/Goblet/Chalice",50.0,130.0,8.0,None
Collective Arts Life In The Clouds IPA,13.99,4.6,7.0,New England / Hazy IPA,Canada,"Craft, Independent Craft Brewer",6.1,50.0,"Hoppy, Tropical",Unknown,"Pint Glass, Snifter/Goblet/Chalice",50.0,130.0,8.0,None
Golden State Cider Brut,13.19,4.6,1.0,Cider,United States,Craft,6.9,35.0,"Apple, Dry","Cheese - Blue, Cheese - Nutty & Semi-Firm","Pint Glass, Snifter/Goblet/Chalice",50.0,130.0,8.0,Gluten-Free
Busch Ice,1.88,4.7,3.0,Light Lager,United States,Craft,4.3,35.0,No special notesbeer_updated,Unknown,Pint Glass,40.0,136.0,4.2,None
Samuel Adams Wicked IPA Variety Pack Beer,19.99,4.0,2.0,Variety Pack Beer,United States,"Craft, Variety Pack",6.8,35.0,"Bright, Citrus, Crisp, Fruity, Jammy, Pineapple, Round, Smooth, Sweet, Tropical, Tropical Fruit","Beef, Chicken, Dessert - Fruit, Fish - White, Salads & Greens",Unknown,49.0,130.0,8.0,None
Counter Weight Headway IPA,12.09,4.8,3.0,IPA,United States,Craft,6.5,35.0,No special notesbeer_updated,Unknown,Snifter/Goblet/Chalice,50.0,130.0,8.0,None
Ace Perry Cider,2.49,4.9,6.0,Perry,United States,Craft,5.0,1.0,"Apple, Pear","Pork, Duck & Game Bird","Pint Glass, Snifter/Goblet/Chalice",50.0,130.0,8.0,Gluten Reduced
Bud Light Orange,9.49,4.4,27.0,American-Style Lager,United States,Craft,4.2,12.0,No special notesbeer_updated,Unknown,Pint Glass,40.0,130.0,8.0,None
Paulaner Original Munich Lager,11.99,4.9,5.0,Helles Lager,Germany,Craft,4.9,20.0,No special notesbeer_updated,Unknown,"Pint Glass, Stein/Pub Mug",45.0,130.0,8.0,None
Jack Daniel's Country Cocktails Black Jack Cola,9.89,4.7,7.0,Malt Liquor,United States,Craft,4.8,35.0,No special notesbeer_updated,Unknown,Pint Glass,40.0,130.0,8.0,None
North Coast Scrimshaw,10.99,4.8,6.0,Pilsner,United States,Craft,4.4,22.0,"Grainy, Grassy, Herbal, Balanced","Fruit - Sweet, Nuts",Pilsner Glass,45.0,130.0,8.0,None
Moosehead Lager,15.99,4.8,10.0,Lager,Canada,Craft,5.0,13.0,"Light, Crisp","Nuts, Beef",Pint Glass,40.0,130.0,8.0,None
Shiner Ruby Redbird,9.99,4.8,5.0,Fruit Beer,United States,Craft,4.01,13.0,"Fruity, Flavored, Grapefruit","Salads & Greens, Cheese - Fresh & Soft","Pint Glass, Snifter/Goblet/Chalice",50.0,95.0,3.0,None
Odell Brewing Mountain Standard IPA,11.49,4.8,10.0,IPA,United States,"Craft, Independent Craft Brewer",6.5,40.0,"Citrus, Fresh, Fruity, Hoppy, Intense, Peach","Cheese - Blue, Cheese - Hard Aged, Cheese - Nutty & Semi-Firm, Chicken, Salads & Greens","Pint Glass, Snifter/Goblet/Chalice",50.0,130.0,8.0,None
Montauk Watermelon Session Ale,14.89,4.4,3.0,Session IPA,United States,Craft,4.9,26.0,"Flavored, Watermelon, Sweet","Fruit - Citrus, Nuts",Pint Glass,50.0,130.0,8.0,None
Chimay Premiere Ale,14.99,4.9,6.0,Dubbel,Belgium,Craft,7.0,19.0,"Dark Fruit, Bready, Balanced, Caramel","Lamb, Turkey",Snifter/Goblet/Chalice,55.0,130.0,8.0,None
Surly Furious IPA,12.05,4.7,11.0,IPA,United States,Craft,6.7,100.0,"Malty, Hoppy, Caramel, Thick","Beef, Root Vegetables","Pint Glass, Snifter/Goblet/Chalice",50.0,130.0,8.0,None
Molson Canadian,8.99,4.8,11.0,American-Style Lager,Canada,Craft,5.0,15.0,"Dry, Light",Nuts,Pint Glass,40.0,130.0,8.0,None
Rogue Batsquatch Hazy IPA,12.99,4.7,7.0,New England / Hazy IPA,United States,Craft,6.7,54.0,No special notesbeer_updated,Unknown,"Pint Glass, Snifter/Goblet/Chalice",50.0,130.0,8.0,None
Omission IPA,10.99,4.7,6.0,IPA,United States,Craft,4.3,65.0,No special notesbeer_updated,Unknown,"Pint Glass, Snifter/Goblet/Chalice",50.0,130.0,8.0,Gluten Reduced
Squatters Hop Rising Double IPA,9.99,4.9,2.0,Imperial / Double IPA,United States,Craft,9.0,72.0,No special notesbeer_updated,Unknown,Snifter/Goblet/Chalice,55.0,130.0,8.0,None
Stone Tangerine Express Hazy IPA,5.99,4.5,6.0,IPA,United States,Craft,6.7,75.0,"Hoppy, Fruity, Tropical Fruit, Citrus","Cheese - Fresh & Soft, Chicken","Pint Glass, Snifter/Goblet/Chalice",50.0,130.0,8.0,None
Mother Road Tower Station IPA,12.99,5.0,3.0,IPA,United States,"Craft, Independent Craft Brewer",7.3,70.0,"Citrus, Stone Fruit, Tropical",Unknown,"Pint Glass, Snifter/Goblet/Chalice",50.0,130.0,8.0,None
Montauk Cold Day Ipa,15.99,4.8,1.0,IPA,United States,Craft,6.7,35.0,No special notesbeer_updated,Unknown,Snifter/Goblet/Chalice,50.0,130.0,8.0,None
Odell Good Behavior Crushable IPA,11.99,4.5,4.0,IPA,United States,"Craft, Independent Craft Brewer",4.0,48.0,"Bright, Citrus, Crisp, Melon, Peach","Dessert - Fruit, Fish - White, Salads & Greens","Pint Glass, Snifter/Goblet/Chalice",50.0,110.0,8.0,None
Two Roads Road 2 Ruin Double IPA,12.99,4.7,4.0,Imperial / Double IPA,United States,"Craft, Independent Craft Brewer",8.0,78.0,"Bitter, Citrus, Floral, Hoppy, Tropical Fruit","Beef, Cheese - Blue, Cheese - Hard Aged, Cheese - Nutty & Semi-Firm, Chicken, Duck & Game Bird, Fruit - Citrus, Lamb",Snifter/Goblet/Chalice,55.0,130.0,8.0,None
Glutenberg India Pale Ale,14.99,4.3,6.0,IPA,Canada,Craft,6.0,76.0,"Hoppy, Citrus, Bitter, Grainy","Salads & Greens, Fruit - Citrus","Pint Glass, Snifter/Goblet/Chalice",50.0,130.0,8.0,Gluten Reduced
Quirk Hard Seltzer Berry & Botanical Mix Pack,18.99,4.8,2.0,Hard Seltzer,United States,Craft,4.2,35.0,No special notesbeer_updated,Unknown,Snifter/Goblet/Chalice,45.0,90.0,3.0,None
Steel Reserve Alloy Series Hard Blackberry,2.49,4.7,2.0,Fruit Beer,United States,Craft,8.0,35.0,No special notesbeer_updated,Unknown,"Pint Glass, Snifter/Goblet/Chalice",50.0,130.0,8.0,None
Sierra Nevada Hoppy Sampler Variety Pack,18.99,4.5,7.0,Variety Pack Beer,United States,"Craft, Variety Pack",7.5,35.0,No special notesbeer_updated,Unknown,"Pint Glass, Stein/Pub Mug, Snifter/Goblet/Chalice",49.0,130.0,8.0,None
Bootstrap Brewing Lush Puppy Juicy IPA,11.49,4.9,4.0,IPA,United States,"Craft, Independent Craft Brewer",6.3,40.0,No special notesbeer_updated,Unknown,"Pint Glass, Snifter/Goblet/Chalice",50.0,130.0,8.0,Gluten Reduced
Brooklyn East IPA,28.98,4.7,5.0,IPA,United States,Craft,6.9,47.0,"Citrus, Grapefruit, Hoppy","Cheese - Creamy & Bloomy, Salads & Greens","Pint Glass, Snifter/Goblet/Chalice",50.0,130.0,8.0,None
Upslope IPA,19.99,4.8,3.0,IPA,United States,Craft,7.2,65.0,"Earthy, Rich, Malty, Pine","Root Vegetables, Mushrooms","Pint Glass, Snifter/Goblet/Chalice",50.0,130.0,8.0,None
Melvin IPA,13.0,4.9,3.0,IPA,United States,"Craft, Independent Craft Brewer",7.5,80.0,"Bitter, Citrus, Hoppy, Intense, Pine","Cheese - Hard Aged, Cured Meats, Duck & Game Bird, Fish - Meaty & Oily","Pint Glass, Snifter/Goblet/Chalice",50.0,130.0,8.0,None
JuneShine Hard Kombucha Acai Berry,22.74,4.4,5.0,Hard Kombucha,United States,"Craft, Independent Craft Brewer",6.0,35.0,"Berry, Blueberry, Bright, Crisp, Earthy, Flavored, Fresh, Fruity",Unknown,Unknown,49.0,130.0,8.0,"Gluten-Free, Kosher, Organic"
Two Robbers Hard Seltzer Variety Pack,19.99,4.5,7.0,Hard Seltzer,United States,"Craft, Independent Craft Brewer, Variety Pack",5.2,35.0,No special notesbeer_updated,Unknown,Snifter/Goblet/Chalice,45.0,110.0,8.0,Gluten-Free
Great Divide Titan IPA,10.99,4.8,3.0,IPA,United States,"Craft, Independent Craft Brewer",7.1,65.0,"Hoppy, Malty, Grapefruit, Citrus","Cheese - Hard Aged, Salads & Greens","Pint Glass, Snifter/Goblet/Chalice",50.0,130.0,8.0,None
Stone Mixed Pack,22.59,4.8,9.0,Variety Pack Beer,United States,"Craft, Variety Pack",12.0,35.0,No special notesbeer_updated,Unknown,"Pint Glass, Stein/Pub Mug, Snifter/Goblet/Chalice",49.0,130.0,8.0,None
Upslope Snow Melt Variety Pack - Spiked Seltzer,19.99,4.8,7.0,Hard Seltzer,United States,"Craft, Variety Pack",5.0,35.0,No special notesbeer_updated,Unknown,Snifter/Goblet/Chalice,45.0,100.0,2.0,Gluten Reduced
Austin Beerworks Fire Eagle IPA,10.99,4.8,2.0,IPA,United States,"Craft, Independent Craft Brewer",7.3,65.0,"Bold, Citrus, Floral, Hoppy, Pine, Strong","Duck & Game Bird, Salads & Greens","Pint Glass, Snifter/Goblet/Chalice",50.0,130.0,8.0,None
Mighty Swell Spiked Seltzer Variety Pack,17.99,4.9,4.0,Hard Seltzer,United States,Variety Pack,5.0,35.0,No special notesbeer_updated,Unknown,"Pint Glass, Stein/Pub Mug, Snifter/Goblet/Chalice",45.0,100.0,3.0,"Gluten-Free, Kosher"
Right Proper Raised By Wolves American Pale Ale,13.97,4.8,2.0,American Pale Ale,DC,Craft,5.0,35.0,No special notesbeer_updated,Unknown,Pint Glass,50.0,130.0,8.0,None
UFO White,18.79,4.7,6.0,Witbier,United States,Craft,5.1,11.0,"Citrus, Herbal, Smooth, Balanced","Fish - White, Salads & Greens",Snifter/Goblet/Chalice,50.0,130.0,8.0,None
Urban South Holy Roller IPA,13.34,4.9,1.0,IPA,United States,Independent Craft Brewer,6.3,35.0,"Hoppy, Pine, Peach, Fruity","Cheese - Fresh & Soft, Chicken","Pint Glass, Snifter/Goblet/Chalice",50.0,130.0,8.0,None
Russian River Blind Pig IPA,7.99,4.8,2.0,IPA,United States,Independent Craft Brewer,6.25,70.0,No special notesbeer_updated,Unknown,"Pint Glass, Snifter/Goblet/Chalice",50.0,130.0,8.0,None
Upslope Mix Box,20.99,4.9,4.0,Variety Pack Beer,United States,"Craft, Variety Pack",7.5,35.0,No special notesbeer_updated,Unknown,"Pint Glass, Stein/Pub Mug, Snifter/Goblet/Chalice",49.0,130.0,8.0,None
Harpoon Rec League Pale Ale,8.99,4.8,5.0,Pale Ale,United States,Craft,3.8,35.0,No special notesbeer_updated,Unknown,Pint Glass,50.0,130.0,8.0,None
Delirium Nocturnum,13.43,4.6,1.0,Belgian Strong Ale,Belgium,Craft,8.5,26.0,"Strong, Dark Fruit, Pruny, Fig","Dessert - Vanilla & Caramel, Cheese - Creamy & Bloomy",Snifter/Goblet/Chalice,55.0,130.0,8.0,None
Kona Hanalei Island IPA,10.99,4.8,9.0,IPA,United States,Craft,4.5,40.0,"Hoppy, Tropical Fruit, Melon - Honeydew, Bright","Fruit - Citrus, Chicken",Pint Glass,50.0,130.0,8.0,None
Austin Eastciders Texas Honey Cider,9.94,4.8,6.0,Cider,United States,"Craft, Independent Craft Brewer",5.0,35.0,"Apple, Fresh, Honey, Sweet","Pork, Cheese - Blue","Pint Glass, Snifter/Goblet/Chalice",50.0,130.0,8.0,"Gluten Reduced, Kosher"
Smirnoff Ice Neon Lemonade Variety Pack,20.89,3.3,1.0,Hard Lemonade,United States,Variety Pack,4.5,35.0,No special notesbeer_updated,Unknown,Unknown,49.0,130.0,8.0,None
Yuengling Golden Pilsner,8.49,4.4,10.0,Pilsner,United States,Craft,4.7,35.0,No special notesbeer_updated,Unknown,Pint Glass,50.0,130.0,8.0,None
"Founders KBS, Bourbon Barrel-Aged Imperial Stout Beer",6.99,4.9,8.0,Oatmeal Stout,United States,Craft,12.0,70.0,"Chocolate, Coffee, Malty, Oak, Roasted, Vanilla","Beef, Cheese - Creamy & Bloomy, Cheese - Fresh & Soft, Dessert - Chocolate & Coffee, Dessert - Vanilla & Caramel, Pork",Snifter/Goblet/Chalice,50.0,340.0,24.0,None
Smirnoff Ice Smash Blue Raspberry + Blackberry,3.49,4.6,3.0,Malt Liquor,United States,Craft,8.0,35.0,No special notesbeer_updated,Unknown,Pint Glass,40.0,130.0,8.0,None
Woodchuck Bubbly Pearsecco Cider,11.99,4.7,3.0,Cider,United States,Craft,6.1,35.0,"Bright, Crisp, Dry, Fresh, Pear",Unknown,"Pint Glass, Snifter/Goblet/Chalice",50.0,160.0,8.0,Gluten-Free
St Bernardus Abt 12,14.73,4.9,4.0,Belgian-Style Ale,Belgium,Craft,10.0,22.0,"Dark Fruit, Balanced, Dried Fruit, Silky","Cheese - Hard Aged, Duck & Game Bird",Snifter/Goblet/Chalice,55.0,130.0,8.0,None
Jack's Hard Cider Variety Pack,22.99,4.7,3.0,Cider,United States,Variety Pack,5.0,35.0,No special notesbeer_updated,Unknown,Unknown,49.0,130.0,8.0,None
Bud Light Seltzer Black Cherry,3.59,4.5,6.0,Hard Seltzer,United States,Craft,5.0,35.0,No special notesbeer_updated,Unknown,Snifter/Goblet/Chalice,45.0,100.0,8.0,"Gluten Reduced, Gluten-Free"
Harpoon Seasonal Variety Pack,18.99,4.3,2.0,Variety Pack Beer,United States,"Seasonal, Variety Pack",406768.0,35.0,No special notesbeer_updated,Unknown,"Pint Glass, Stein/Pub Mug, Snifter/Goblet/Chalice",49.0,130.0,8.0,None
Fremont Sky Kraken Hazy Pale Ale,12.99,4.8,1.0,Pale Ale,United States,Craft,5.5,35.0,No special notesbeer_updated,Unknown,"Pint Glass, Snifter/Goblet/Chalice",50.0,130.0,8.0,None
Two Roads IPA Variety Pack,19.79,4.7,2.0,Variety Pack Beer,United States,"Craft, Independent Craft Brewer, Variety Pack",406768.0,35.0,"Fresh, Hoppy, Thick",Unknown,"Pint Glass, Stein/Pub Mug, Snifter/Goblet/Chalice",49.0,130.0,8.0,None
Union Craft Brewing Divine IPA,12.99,4.7,1.0,IPA,United States,Craft,6.5,35.0,No special notesbeer_updated,Unknown,"Pint Glass, Snifter/Goblet/Chalice",50.0,130.0,8.0,None
Malibu Splash Hangout Mix Pack Sparkling Malt Beverage,17.99,4.7,6.0,Malt Liquor,Trinidad And Tobago,Craft,5.0,35.0,No special notesbeer_updated,Unknown,Pint Glass,40.0,130.0,8.0,None
SanTan Brewing MoonJuice Galactic IPA,11.49,4.8,5.0,IPA,United States,"Craft, Independent Craft Brewer",7.3,65.0,"Citrus, Tropical Fruit",Unknown,"Pint Glass, Snifter/Goblet/Chalice",50.0,130.0,8.0,None
Dogfish Head Hazy-O! Hazy IPA,11.99,4.7,4.0,New England / Hazy IPA,United States,Craft,7.1,45.0,"Pineapple, Tropical",Unknown,Snifter/Goblet/Chalice,50.0,130.0,8.0,None
Smirnoff Ice Smash Pineapple Coconut,3.49,4.6,4.0,Malt Liquor,United States,Craft,8.0,35.0,"Tropical, Tropical Fruit",Unknown,Pint Glass,40.0,130.0,8.0,None
Fremont Golden Pilsner,11.99,4.7,1.0,Pilsner,United States,Craft,4.5,20.0,No special notesbeer_updated,Unknown,Pilsner Glass,45.0,130.0,8.0,None
Narragansett Del's Lemon Shandy,30.99,4.7,6.0,Shandy / Radler,United States,Craft,4.7,14.0,"Citrus, Flavored, Fruity, Light, Sweet, Tart","Chicken, Dessert - Fruit, Nuts, Salads & Greens, Shellfish","Pint Glass, Pilsner Glass",45.0,165.0,8.0,None
Redbridge Gluten-Free Lager,10.99,4.6,12.0,Amber / Vienna Lager,United States,Craft,4.7,35.0,"Fruity, Toasty, Grainy","Pork, Cheese - Hard Aged","Pint Glass, Pilsner Glass",50.0,130.0,8.0,Gluten Reduced
Murphy's Stout,8.39,4.4,10.0,Dry Stout,Ireland,Craft,4.0,34.0,No special notesbeer_updated,Unknown,Pint Glass,50.0,130.0,8.0,None
21st Amendment Brew Free or Die Blood Orange,10.99,4.5,10.0,IPA,United States,Craft,7.0,70.0,"Citrus, Fruity, Pine, Sweet","Duck & Game Bird, Cheese - Fresh & Soft","Pint Glass, Snifter/Goblet/Chalice",50.0,130.0,8.0,None
Beck's Non-Alcoholic,9.89,4.6,12.0,Pilsner,Germany,Non-Alcoholic,0.0,12.0,"Bright, Light, Malty","Nuts, Cured Meats",Pint Glass,40.0,130.0,8.0,Non-Alcoholic
Horse & Dragon Sad Panda Coffee Stout,13.99,5.0,1.0,Stout,United States,Craft,6.8,35.0,No special notesbeer_updated,Unknown,"Pint Glass, Snifter/Goblet/Chalice",50.0,130.0,8.0,None
Rekorderlig Strawberry Lime Cider,10.99,4.6,13.0,Cider,Sweden,Craft,4.5,35.0,"Apple, Sweet, Flavored","Pork, Salads & Greens","Pint Glass, Snifter/Goblet/Chalice",50.0,130.0,8.0,Gluten Reduced
Bishop Cider Crackberry,10.9,4.6,8.0,Cider,United States,Craft,6.0,35.0,"Balanced, Berry, Bold, Tart",Unknown,"Pint Glass, Snifter/Goblet/Chalice",50.0,190.0,17.0,Gluten-Free
Eddyline Epic Day Double IPA,14.99,4.7,5.0,IPA,United States,Craft,10.0,35.0,No special notesbeer_updated,Unknown,"Pint Glass, Snifter/Goblet/Chalice",50.0,130.0,8.0,None
Mighty Squirrel Mango Lassi,16.79,4.4,2.0,Sour / Wild Ale,United States,Craft,7.0,65.0,No special notesbeer_updated,Unknown,"Snifter/Goblet/Chalice, Stange",50.0,130.0,8.0,None
Great Divide Yeti Imperial Stout,14.25,4.7,8.0,Imperial Stout,United States,"Craft, Independent Craft Brewer",9.5,75.0,"Chocolate, Coffee, Roasted, Rich","Dessert - Vanilla & Caramel, Dessert - Chocolate & Coffee",Snifter/Goblet/Chalice,50.0,130.0,8.0,None
Downeast Seasonal Blend Cider,12.09,4.5,13.0,Cider,United States,Seasonal,5.1,35.0,No special notesbeer_updated,Unknown,"Pint Glass, Snifter/Goblet/Chalice",50.0,130.0,8.0,Gluten Reduced
Austin Eastciders Brut Super Dry Cider,10.99,4.7,9.0,Cider,United States,"Craft, Independent Craft Brewer",4.2,35.0,"Apple, Crisp, Dry, Light",Unknown,"Pint Glass, Snifter/Goblet/Chalice",50.0,130.0,8.0,"Gluten Reduced, Kosher"
Abita Andygator,11.99,4.9,2.0,Doppelbock,United States,"Craft, Independent Craft Brewer",8.0,25.0,No special notesbeer_updated,Shellfish,"Pint Glass, Stein/Pub Mug",55.0,130.0,8.0,None
Kona Island Hopper Variety Pack,18.99,4.8,5.0,Variety Pack Beer,United States,"Craft, Variety Pack",7.3,35.0,No special notesbeer_updated,Unknown,"Pint Glass, Stein/Pub Mug, Snifter/Goblet/Chalice",49.0,130.0,8.0,None
Elysian Contact Haze IPA,13.9,4.5,7.0,New England / Hazy IPA,United States,Craft,47.0,39.0,No special notesbeer_updated,Unknown,Snifter/Goblet/Chalice,50.0,130.0,8.0,None
