Name,Price,Rating,Reviews,Category,Region,Type,ABV,IBU,Tasting_Notes,Food_Pairing,Suggested_Glassware,Suggested_Serving_Temperature (F),Calories Per Serving (12 Oz),Carbs Per Serving (12 Oz),Features
Bira 91 IPA,9.99,4.0,1.0,IPA,India,Craft,6.5,35.0,No special notesbeer_updated,Unknown,"Pint Glass, Snifter/Goblet/Chalice",50.0,130.0,8.0,None
Seattle Cider Basil Mint,11.99,5.0,1.0,Cider,United States,Craft,6.9,35.0,No special notesbeer_updated,Unknown,"Pint Glass, Snifter/Goblet/Chalice",50.0,130.0,8.0,Gluten Reduced
Arizona Sunrise Hard Seltzer Mucho Mango,3.0,3.4,1.0,Hard Seltzer,United States,Craft,4.6,0.0,No special notesbeer_updated,Unknown,Snifter/Goblet/Chalice,45.0,130.0,8.0,None
Troegs Grand Cacao Chocolate Stout,2.3,4.0,1.0,Stout,United States,"Craft, Independent Craft Brewer",6.5,35.0,No special notesbeer_updated,Unknown,Pint Glass,50.0,130.0,8.0,None
Harpoon Camp Wannamango,12.99,4.0,1.0,American Pale Ale,United States,Craft,5.0,22.0,No special notesbeer_updated,Unknown,Pint Glass,50.0,130.0,8.0,None
Smith & Forge Hard Cider,16.49,4.2,3.0,Cider,United States,Craft,30.0,10.0,"Apple, Dry, Syrupy","Pork, Cheese - Blue","Pint Glass, Snifter/Goblet/Chalice",50.0,130.0,8.0,Gluten Reduced
Cape Line Sparkling Cocktails Variety Pack Gluten Free,17.49,3.5,4.0,Hard Seltzer,United States,Variety Pack,14.0,35.0,No special notesbeer_updated,Unknown,"Pint Glass, Mason Jar",45.0,120.0,9.0,Gluten Reduced
Blue Point Shore Thing Lager,10.99,4.6,1.0,Pale Lager,United States,Craft,5.0,20.0,"Bready, Crisp, Malty",Unknown,Pint Glass,45.0,130.0,8.0,None
Destihl Wild Sour Series: Flanders Red,10.99,4.8,3.0,Sour / Wild Ale,United States,Craft,5.9,18.0,"Tart, Sour, Acidic, Caramel","Cheese - Creamy & Bloomy, Lamb","Snifter/Goblet/Chalice, Stange",50.0,130.0,8.0,None
Kopparberg Pear Cider,9.99,4.0,3.0,Perry,Sweden,Craft,4.5,35.0,"Fruity, Light, Sweet","Beef, Cheese - Blue, Cheese - Creamy & Bloomy, Cheese - Fresh & Soft, Cheese - Hard Aged, Cheese - Nutty & Semi-Firm, Cheese - Stinky, Chicken, Cured Meats, Dessert - Chocolate & Coffee, Dessert - Fruit, Dessert - Vanilla & Caramel, Duck & Game Bird, Fish - Meaty & Oily, Fish - White, Fruit - Citrus, Fruit - Dried, Fruit - Sweet, Lamb, Mushrooms, Nuts, Pasta, Pork, Root Vegetables, Salads & Greens, Shellfish, Turkey","Pint Glass, Snifter/Goblet/Chalice",50.0,130.0,8.0,"Gluten Reduced, Organic"
Upslope Brown Ale,9.99,5.0,1.0,Brown Ale,United States,Craft,6.7,35.0,"Caramel, Hoppy, Dry, Roasted","Lamb, Pork","Pint Glass, Stein/Pub Mug",50.0,130.0,8.0,None
Elysian Brewing Mens Room Red Ale,12.09,3.8,2.0,Amber / Red Ale,United States,Craft,6.3,51.0,"Caramel, Dark Fruit, Rich, Toasty","Lamb, Fruit - Dried",Pint Glass,50.0,130.0,8.0,None
Devils Backbone Gold Leaf Lager,0.0,4.1,1.0,Helles Lager,United States,Craft,4.5,21.0,"Bready, Crisp, Fresh, Light, Smooth","Cheese - Creamy & Bloomy, Cured Meats, Duck & Game Bird, Fish - White, Lamb, Nuts, Pasta, Pork, Root Vegetables, Salads & Greens, Shellfish, Tomatoes, Turkey","Pint Glass, Stein/Pub Mug",45.0,130.0,8.0,None
Grimm Double Negative Imperial Stout,15.04,5.0,1.0,Imperial Stout,United States,Craft,10.0,35.0,No special notesbeer_updated,Unknown,Snifter/Goblet/Chalice,50.0,130.0,8.0,None
21st Amendment Fireside Chat,11.37,4.7,1.0,Winter Warmer,United States,"Craft, Seasonal",7.9,45.0,No special notesbeer_updated,Unknown,"Pint Glass, Stein/Pub Mug, Snifter/Goblet/Chalice",50.0,130.0,8.0,None
Downeast Winter Blend Cider,10.99,4.7,8.0,Cider,United States,Craft,6.5,35.0,"Apple, Sweet, Spicy","Dessert - Fruit, Dessert - Vanilla & Caramel","Pint Glass, Snifter/Goblet/Chalice",50.0,130.0,8.0,Gluten Reduced
Terrapin Seasonal,11.99,5.0,1.0,IPA,United States,"Craft, Seasonal",6.0,35.0,No special notesbeer_updated,Unknown,"Pint Glass, Snifter/Goblet/Chalice",50.0,130.0,8.0,None
Smirnoff Ice Blueberry Lemonade,8.99,4.3,1.0,Malt Liquor,United States,Craft,5.0,35.0,No special notesbeer_updated,Unknown,Pint Glass,40.0,130.0,8.0,None
Kona Castaway IPA,9.99,4.7,2.0,IPA,United States,Craft,6.0,50.0,"Floral, Citrus, Earthy, Dry","Beef, Root Vegetables","Pint Glass, Snifter/Goblet/Chalice",50.0,130.0,8.0,None
Pinkus Organic Pilsner,4.12,4.4,3.0,Pilsner,Germany,Craft,5.2,32.0,No special notesbeer_updated,Unknown,Pilsner Glass,45.0,130.0,8.0,Organic
North Coast Red Seal Ale,11.49,5.0,1.0,Amber / Red Ale,United States,Craft,5.4,42.0,"Caramel, Malty, Dark Fruit, Dry","Pork, Fruit - Dried",Pint Glass,50.0,130.0,8.0,None
NEON BURST™ Punch Blast,3.59,4.3,3.0,Malt Liquor,United States,Craft,8.0,35.0,No special notesbeer_updated,Unknown,Pint Glass,40.0,130.0,8.0,None
Eureka Heights Mostly Harmless Pale Ale,9.96,4.3,1.0,American Pale Ale,United States,Independent Craft Brewer,4.5,42.0,"Biscuit, Bready, Citrus, Hoppy",Unknown,Pint Glass,50.0,130.0,8.0,None
Golden Road Brewing Wolf Among Weeds IPA,11.99,4.6,1.0,Imperial / Double IPA,United States,Craft,4.0,75.0,"Citrus, Crisp, Hoppy, Pine, Strong",Unknown,Snifter/Goblet/Chalice,55.0,130.0,8.0,None
Four Peaks Brewing Company Peach Ale,10.99,4.8,2.0,Fruit Beer,United States,Craft,4.5,35.0,No special notesbeer_updated,Unknown,"Pint Glass, Snifter/Goblet/Chalice",50.0,130.0,8.0,None
Wellbeing Heavenly Body Non-Alcoholic Golden Wheat,10.99,4.3,4.0,Non-Alcoholic Beer,United States,Non-Alcoholic,0.0,7.0,No special notesbeer_updated,Unknown,Unknown,40.0,68.0,8.0,None
Double Nickel Vienna Lager,10.99,5.0,2.0,Amber / Vienna Lager,United States,Craft,5.3,35.0,"Caramel, Dry, Nutty, Smooth",Unknown,"Pint Glass, Pilsner Glass",50.0,130.0,8.0,None
Glunz Vin Glogg A Winter Wine,14.49,5.0,1.0,Winter Warmer,United States,Craft,13.0,35.0,No special notesbeer_updated,Unknown,Snifter/Goblet/Chalice,55.0,130.0,8.0,None
Rahr & Sons Dadgum IPA,10.92,5.0,1.0,IPA,United States,Craft,6.6,35.0,No special notesbeer_updated,Unknown,"Pint Glass, Snifter/Goblet/Chalice",50.0,130.0,8.0,None
Ballast Point Lager,10.99,4.8,1.0,Light Lager,United States,"Craft, Independent Craft Brewer",4.2,10.0,"Crisp, Fruity, Grainy",Unknown,Pint Glass,45.0,130.0,8.0,Gluten Reduced
Maine Beer Company Spring IPA,7.99,4.3,1.0,IPA,United States,"Craft, Independent Craft Brewer, Seasonal",6.5,35.0,"Balanced, Fresh, Pine, Tropical Fruit","Chicken, Turkey","Pint Glass, Snifter/Goblet/Chalice",50.0,130.0,8.0,None
Mysters Hard Seltzer,17.99,4.5,2.0,Hard Seltzer,United States,"Independent Craft Brewer, Variety Pack",5.0,35.0,No special notesbeer_updated,Unknown,Snifter/Goblet/Chalice,45.0,110.0,2.0,Gluten Reduced
Fair State Roselle Hibiscus Sour,14.49,4.7,2.0,Saison / Farmhouse Ale,United States,Craft,5.7,35.0,No special notesbeer_updated,Unknown,Snifter/Goblet/Chalice,55.0,130.0,8.0,None
Cidergeist Dry Hopped Hard Cider,11.29,4.3,3.0,Cider,United States,Craft,6.2,35.0,"Apple, Citrus, Dry, Yeasty","Pork, Fruit - Sweet","Pint Glass, Snifter/Goblet/Chalice",50.0,130.0,8.0,Gluten Reduced
Angry Orchard Pear Cider,10.49,4.2,4.0,Perry,United States,Craft,5.0,7.0,No special notesbeer_updated,Unknown,"Pint Glass, Snifter/Goblet/Chalice",50.0,130.0,8.0,Gluten Reduced
Lamplighter Cuppa English Pale Ale,14.99,4.0,1.0,English Pale Ale / Bitter / ESB,United States,Craft,5.3,35.0,No special notesbeer_updated,Unknown,"Pint Glass, Stein/Pub Mug",55.0,130.0,8.0,None
Gruvi Non-Alcoholic Stout,9.99,3.8,3.0,Non-Alcoholic Beer,United States,"Craft, Non-Alcoholic",0.5,35.0,"Chocolate, Coffee, Dry, Earthy, Roasted",Unknown,Unknown,49.0,45.0,8.0,None
JuneShine Hard Kombucha Rosé,5.99,4.3,1.0,Hard Kombucha,United States,"Craft, Independent Craft Brewer",6.0,35.0,"Acidic, Balanced, Bright, Crisp, Fruity",Unknown,Unknown,49.0,130.0,8.0,"Gluten-Free, Kosher, Organic"
Foundation Epiphany IPA,17.99,4.4,1.0,IPA,United States,Craft,8.0,85.0,No special notesbeer_updated,Unknown,"Pint Glass, Snifter/Goblet/Chalice",50.0,130.0,8.0,None
Horny Goat Salted Caramel Brown Ale,10.99,4.0,1.0,Brown Ale,United States,Craft,6.5,35.0,No special notesbeer_updated,Unknown,"Pint Glass, Stein/Pub Mug",50.0,130.0,8.0,None
Smirnoff Ice Peach Bellini,9.68,5.0,1.0,Malt Liquor,United States,Craft,5.8,35.0,No special notesbeer_updated,Unknown,Pint Glass,40.0,130.0,8.0,None
Left Hand Wheels Gose Round,12.49,4.3,1.0,Gose,United States,"Craft, Independent Craft Brewer",4.4,14.0,"Acidic, Berry, Bright, Citrus, Crisp, Fresh, Salty, Sour, Tart",Unknown,Stange,45.0,130.0,8.0,Gluten Reduced
Prairie Blueberry Boyfriend Sour Ale,11.99,4.0,2.0,Sour / Wild Ale,United States,Craft,5.4,35.0,No special notesbeer_updated,Unknown,"Snifter/Goblet/Chalice, Stange",50.0,130.0,8.0,None
Coors Black Cherry Hard Seltzer,3.19,4.3,2.0,Hard Seltzer,United States,Craft,5.0,35.0,"Acidic, Cherry, Crisp, Fruity, Light",Unknown,Snifter/Goblet/Chalice,45.0,90.0,8.0,Gluten-Free
Heavy Seas Siren Noire,8.99,5.0,1.0,Imperial Stout,United States,Craft,9.5,19.0,No special notesbeer_updated,Unknown,Snifter/Goblet/Chalice,50.0,130.0,8.0,None
21st Amendment Seasonal,10.99,4.4,1.0,Seasonal Beer,United States,"Craft, Seasonal",4.9,35.0,No special notesbeer_updated,Unknown,"Pint Glass, Stein/Pub Mug, Snifter/Goblet/Chalice",49.0,130.0,8.0,None
Revolution Brewing Seasonal,11.99,4.0,3.0,Seasonal Beer,United States,"Craft, Seasonal",6.5,31.0,"Bright, Crisp, Fresh","Dessert - Vanilla & Caramel, Nuts","Pint Glass, Stein/Pub Mug, Snifter/Goblet/Chalice",49.0,130.0,8.0,None
Pauwel Kwak Belgian Ale,13.0,5.0,1.0,Belgian Strong Ale,Belgium,Craft,8.4,20.0,No special notesbeer_updated,Unknown,Snifter/Goblet/Chalice,55.0,130.0,8.0,None
Shock Top Seasonal,8.99,5.0,4.0,Seasonal Beer,United States,Seasonal,4.2,32.0,No special notesbeer_updated,Unknown,"Pint Glass, Stein/Pub Mug, Snifter/Goblet/Chalice",49.0,130.0,8.0,None
Breckenridge Brewery Nitro Vanilla Porter,9.99,5.0,2.0,Porter,United States,Craft,4.8,16.0,No special notesbeer_updated,Unknown,"Pint Glass, Stein/Pub Mug",50.0,130.0,8.0,None
21st Amendment Blah Blah Blah,13.29,4.5,2.0,Imperial / Double IPA,United States,Craft,8.0,65.0,"Floral, Tropical Fruit, Fruity, Malty","Fruit - Citrus, Nuts",Snifter/Goblet/Chalice,55.0,130.0,8.0,None
Odd13 Brewing Noob Pale Ale,11.99,4.8,2.0,IPA,United States,Craft,6.0,60.0,"Hoppy, Malty, Citrus, Grapefruit","Mushrooms, Fruit - Citrus","Pint Glass, Snifter/Goblet/Chalice",50.0,130.0,8.0,Gluten Reduced
Yazoo Dos Perros,10.99,5.0,1.0,Brown Ale,United States,Craft,5.5,35.0,No special notesbeer_updated,Unknown,"Pint Glass, Stein/Pub Mug",50.0,130.0,8.0,None
Lost Coast Watermelon Wheat,9.99,5.0,1.0,Fruit Beer,United States,Craft,5.0,20.0,No special notesbeer_updated,Unknown,"Pint Glass, Snifter/Goblet/Chalice",50.0,130.0,8.0,None
Appleation Sweet Hard Cider,6.49,5.0,1.0,Cider,United States,Craft,6.5,35.0,No special notesbeer_updated,Unknown,"Pint Glass, Snifter/Goblet/Chalice",50.0,130.0,8.0,Gluten Reduced
3 Floyds Brewing Robert The Bruce Scottish Ale,0.0,4.9,2.0,Scotch Ale / Wee Heavy,United States,Craft,7.5,32.0,No special notesbeer_updated,Unknown,Snifter/Goblet/Chalice,60.0,130.0,8.0,None
Tucher Helles Hefe Weizen,2.59,4.5,1.0,Hefeweizen,Germany,Craft,5.3,13.0,No special notesbeer_updated,Unknown,Weizen Glass,50.0,130.0,8.0,None
Sierra Nevada Hop Hunter IPA,9.99,5.0,1.0,IPA,United States,Craft,6.2,60.0,"Citrus, Pine, Malty, Hoppy","Salads & Greens, Cheese - Nutty & Semi-Firm","Pint Glass, Snifter/Goblet/Chalice",50.0,130.0,8.0,None
Brewer's Art Birdhouse Pale Ale,12.99,5.0,1.0,Pale Ale,Japan,Craft,5.0,35.0,"Fruity, Yeasty, Caramel, Dark Fruit","Pork, Cured Meats","Pint Glass, Snifter/Goblet/Chalice",50.0,130.0,8.0,None
Delirium Deliria,13.99,5.0,1.0,Belgian-Style Ale,Belgium,Craft,8.5,30.0,"Floral, Green Apple, Sweet","Cheese - Nutty & Semi-Firm, Nuts",Snifter/Goblet/Chalice,55.0,130.0,8.0,None
Sun King Seasonal,8.99,4.3,2.0,Seasonal Beer,United States,Seasonal,7.7,35.0,No special notesbeer_updated,Unknown,"Pint Glass, Stein/Pub Mug, Snifter/Goblet/Chalice",49.0,130.0,8.0,None
O'Hara's Irish Red,10.29,4.0,1.0,Amber / Red Ale,Ireland,Craft,4.3,34.0,No special notesbeer_updated,Unknown,Pint Glass,50.0,130.0,8.0,None
Fulton Sweet Child Of Vine,9.97,4.9,2.0,IPA,United States,Independent Craft Brewer,6.1,69.0,"Balanced, Floral, Hoppy, Malty",Unknown,"Pint Glass, Snifter/Goblet/Chalice",50.0,130.0,8.0,Gluten Reduced
Ommegang Rosetta,11.99,5.0,1.0,Fruit Beer,United States,Craft,5.6,9.0,"Tart, Cherry, Fruity, Dry","Lamb, Dessert - Vanilla & Caramel","Pint Glass, Snifter/Goblet/Chalice",50.0,130.0,8.0,None
Funkwerks Raspberry Provincial,9.99,4.5,3.0,Berliner Weisse,United States,Craft,4.2,16.0,"Red Fruit, Currant, Tart, Sour","Cheese - Fresh & Soft, Chicken",Snifter/Goblet/Chalice,50.0,130.0,8.0,None
Quilmes Cristal Beer,11.33,5.0,1.0,American-Style Lager,Argentina,Craft,4.9,12.0,No special notesbeer_updated,Unknown,Pint Glass,40.0,130.0,8.0,None
Sunner Kolsch,4.39,3.5,1.0,Kölsch,Germany,Craft,5.4,35.0,No special notesbeer_updated,Unknown,Stange,45.0,130.0,8.0,None
Dry Dock Brewing Vanilla Porter,6.49,4.8,2.0,Porter,United States,Craft,5.4,35.0,"Vanilla, Chocolate, Sweet, Coffee","Dessert - Vanilla & Caramel, Dessert - Fruit","Pint Glass, Stein/Pub Mug",50.0,130.0,8.0,None
Highland Black Mocha Stout,2.39,5.0,1.0,Stout,United States,Craft,5.0,30.0,No special notesbeer_updated,Unknown,"Pint Glass, Snifter/Goblet/Chalice",50.0,130.0,8.0,None
Yuengling Seasonal,1.99,4.5,2.0,Marzen / Oktoberfest,United States,Seasonal,5.4,35.0,No special notesbeer_updated,Unknown,"Pint Glass, Stein/Pub Mug",50.0,130.0,8.0,None
Upslope Experimental IPA,11.24,4.0,1.0,IPA,United States,Craft,7.0,60.0,No special notesbeer_updated,Unknown,"Pint Glass, Snifter/Goblet/Chalice",50.0,130.0,8.0,None
Almanac Loud! Hazy Double IPA,19.8,4.5,2.0,Imperial / Double IPA,United States,Craft,8.0,38.0,No special notesbeer_updated,Unknown,Snifter/Goblet/Chalice,55.0,130.0,8.0,None
Thorn Brewing Barrio Lager,11.99,5.0,1.0,Lager,United States,Craft,4.5,35.0,No special notesbeer_updated,Unknown,"Pint Glass, Stein/Pub Mug, Snifter/Goblet/Chalice",49.0,130.0,8.0,None
Golden Road Brewing Fruit Cart Seltzer,17.99,4.0,3.0,Variety Pack Beer,United States,"Craft, Variety Pack",4.8,35.0,"Bright, Citrus, Fresh, Fruity, Light, Pineapple, Sweet, Tropical, Tropical Fruit, Watermelon","Chicken, Fish - White, Fruit - Citrus, Root Vegetables, Salads & Greens, Shellfish",Unknown,49.0,130.0,8.0,None
Sierra Nevada Sierraveza Lager,10.49,4.2,1.0,Pale Lager,United States,Craft,5.6,18.0,No special notesbeer_updated,Unknown,Pint Glass,45.0,130.0,8.0,None
Austin Eastciders Sangria Cider (Seasonal),14.0,4.3,1.0,Cider,United States,"Craft, Independent Craft Brewer, Seasonal",5.0,35.0,"Berry, Citrus, Fruity, Stone Fruit",Unknown,Unknown,49.0,130.0,8.0,"Gluten Reduced, Kosher"
Hardywood Bourbon Barrel Gingerbread Stout,14.5,5.0,1.0,Stout,United States,Craft,10.6,35.0,No special notesbeer_updated,Unknown,"Pint Glass, Snifter/Goblet/Chalice",50.0,130.0,8.0,None
Half Acre Specialty Grow Greater,14.99,4.5,1.0,IPA,United States,Craft,7.0,35.0,No special notesbeer_updated,Unknown,Snifter/Goblet/Chalice,50.0,130.0,8.0,None
Harpoon Box O' Beer,18.99,4.8,1.0,Variety Pack Beer,United States,Craft,6.0,35.0,No special notesbeer_updated,Unknown,Unknown,49.0,130.0,8.0,None
Natural Light Seltzer Catalina Lime Mixer,14.08,4.5,5.0,Hard Seltzer,United States,Craft,6.0,35.0,No special notesbeer_updated,Unknown,Snifter/Goblet/Chalice,45.0,133.0,4.0,Gluten Reduced
Luna Bay Luna Lemonade Hard Kombucha,81.49,4.0,1.0,Hard Kombucha,United States,Craft,6.0,35.0,"Acidic, Crisp, Fresh, Light",Unknown,Unknown,49.0,130.0,8.0,Gluten-Free
Altamont Maui Waui IPA,19.99,3.0,1.0,IPA,United States,Craft,6.5,35.0,No special notesbeer_updated,Unknown,Pint Glass,50.0,130.0,8.0,None
SanTan Brewing Arizona Style Lager,10.99,5.0,2.0,American-Style Lager,United States,"Craft, Independent Craft Brewer",4.7,35.0,No special notesbeer_updated,Unknown,Pilsner Glass,40.0,130.0,8.0,None
Bale Breaker Dormancy Stout,14.29,3.5,1.0,Stout,United States,"Craft, Independent Craft Brewer",6.8,50.0,"Chocolate, Coffee, Dried Fruit, Rich, Roasted, Smoky, Vanilla","Beef, Cheese - Blue, Cheese - Creamy & Bloomy, Cheese - Hard Aged, Cheese - Nutty & Semi-Firm, Cheese - Stinky, Dessert - Chocolate & Coffee, Dessert - Vanilla & Caramel, Pork","Pint Glass, Snifter/Goblet/Chalice",50.0,130.0,8.0,None
Willie's Superbrew Real Ginger & Lemons Hard Seltzer,11.99,5.0,3.0,Hard Seltzer,United States,"Craft, Independent Craft Brewer",4.5,35.0,"Balanced, Bright, Citrus, Crisp, Herbal, Light","Salads & Greens, Fish - White, Cheese - Fresh & Soft, Cheese - Hard Aged, Fish - Meaty & Oily",Pint Glass,45.0,120.0,8.0,Gluten-Free
Lamplighter Werewolves Of Cambridge Porter,15.99,5.0,1.0,Porter,United States,Craft,7.3,35.0,No special notesbeer_updated,Unknown,"Pint Glass, Stein/Pub Mug",50.0,130.0,8.0,None
Urban South Seasonal,12.09,5.0,1.0,Stout,United States,Seasonal,406768.0,35.0,No special notesbeer_updated,Unknown,"Pint Glass, Snifter/Goblet/Chalice",50.0,130.0,8.0,None
Natural Light Seltzer Aloha Beaches,14.71,4.4,2.0,Hard Seltzer,United States,Craft,5.9,35.0,No special notesbeer_updated,Unknown,Snifter/Goblet/Chalice,45.0,133.0,4.0,Gluten Reduced
Pabst Blue Ribbon Stronger Seltzer Lime,1.99,3.8,3.0,Hard Seltzer,United States,Craft,8.0,35.0,"Balanced, Bright, Citrus, Crisp, Fruity, Strong","Cheese - Nutty & Semi-Firm, Chicken, Fish - White, Pork, Salads & Greens, Turkey",Snifter/Goblet/Chalice,45.0,171.0,2.8,Gluten Reduced
Saint Archer Hazy IPA,11.99,4.5,1.0,New England / Hazy IPA,United States,Craft,6.2,48.0,No special notesbeer_updated,Unknown,"Pint Glass, Snifter/Goblet/Chalice",50.0,130.0,8.0,None
Firestone Walker Nitro Merlin Milk Stout,10.99,4.5,6.0,Milk Stout,United States,Craft,5.5,27.0,"Bold, Creamy, Malty, Round, Smooth, Thick, Toasty","Dessert - Chocolate & Coffee, Dessert - Fruit, Dessert - Vanilla & Caramel, Nuts",Pint Glass,50.0,130.0,8.0,None
Avery Raspberry Sour,13.49,4.0,1.0,Wild Ale,United States,"Independent Craft Brewer, Craft",6.5,8.0,No special notesbeer_updated,Unknown,"Snifter/Goblet/Chalice, Stange",50.0,130.0,8.0,None
Anderson Valley Bourbon Barrel Stout,10.29,3.7,1.0,Stout,United States,Craft,6.9,14.0,No special notesbeer_updated,Unknown,"Pint Glass, Snifter/Goblet/Chalice",50.0,231.0,8.0,None
DuClaw Funk Blueberry Citrus Wheat,10.99,4.7,2.0,American-Style Lager,United States,"Craft, Independent Craft Brewer",5.0,16.0,"Blueberry, Citrus, Earthy, Fresh, Fruity, Light","Cheese - Fresh & Soft, Dessert - Fruit, Dessert - Vanilla & Caramel, Fish - White, Fruit - Dried, Fruit - Sweet, Shellfish",Pint Glass,50.0,130.0,8.0,None
SanTan Brewing Seasonal,10.49,3.7,2.0,Ale,United States,"Craft, Independent Craft Brewer, Seasonal",5.0,35.0,Fruity,Unknown,Pint Glass,50.0,130.0,8.0,None
Michelob Golden Draft Lager,22.99,4.0,1.0,American-Style Lager,United States,Craft,4.6,35.0,No special notesbeer_updated,Unknown,Pint Glass,40.0,130.0,8.0,None
Strongbow Variety Pack,17.59,4.6,9.0,Cider,United Kingdom,Variety Pack,5.0,35.0,No special notesbeer_updated,Unknown,"Pint Glass, Snifter/Goblet/Chalice",50.0,130.0,8.0,Gluten Reduced
Lancaster Milk Stout,10.99,5.0,1.0,Milk Stout,United States,Craft,5.3,35.0,No special notesbeer_updated,Unknown,Pint Glass,50.0,130.0,8.0,None
Great Lakes Chillwave Double IPA,11.99,3.7,2.0,Imperial / Double IPA,United States,Craft,9.0,80.0,"Honey, Malty, Strong, Thick, Tropical","Dessert - Fruit, Lamb",Snifter/Goblet/Chalice,55.0,130.0,8.0,None
Pyramid Hefeweizen,9.99,4.2,2.0,Hefeweizen,United States,Craft,5.2,18.0,No special notesbeer_updated,Unknown,Weizen Glass,50.0,130.0,8.0,None
Great Lakes Burning River Pale Ale,10.99,4.0,2.0,American Pale Ale,United States,Craft,6.0,45.0,"Citrus, Pine","Beef, Cheese - Blue, Cheese - Creamy & Bloomy, Cheese - Nutty & Semi-Firm",Pint Glass,50.0,130.0,8.0,None
Boulevard Single Wide IPA,9.99,5.0,1.0,IPA,United States,Craft,5.7,57.0,"Hoppy, Fruity, Melon - Honeydew, Light","Chicken, Fruit - Sweet","Pint Glass, Snifter/Goblet/Chalice",50.0,130.0,8.0,None
Woodchuck Raspberry Hard Cider,9.99,4.1,1.0,Cider,United States,Craft,4.0,35.0,"Balanced, Berry, Flavored, Red Fruit, Sweet","Cheese - Fresh & Soft, Cheese - Blue","Pint Glass, Snifter/Goblet/Chalice",50.0,170.0,8.0,Gluten-Free
Golden Road Brewing Point the Way IPA,10.99,4.5,1.0,IPA,United States,Craft,5.8,60.0,"Citrus, Crisp, Hoppy, Light, Pine, Smooth, Strong, Tropical, Tropical Fruit",Unknown,"Pint Glass, Snifter/Goblet/Chalice",50.0,130.0,8.0,None
Rahr & Sons Ugly Pug,9.99,5.0,1.0,Schwarzbier,United States,Craft,5.5,27.0,No special notesbeer_updated,Unknown,"Pint Glass, Stein/Pub Mug",50.0,130.0,8.0,None
Destihl Wild Sour Lynnbrook Raspberry,10.99,5.0,1.0,Sour / Wild Ale,United States,Craft,4.2,4.0,No special notesbeer_updated,Unknown,"Snifter/Goblet/Chalice, Stange",50.0,130.0,8.0,None
Horny Goat Chocolate Peanut Butter Porter,10.99,4.0,3.0,Porter,United States,Craft,6.5,55.0,No special notesbeer_updated,Unknown,"Pint Glass, Stein/Pub Mug",50.0,130.0,8.0,None
Castle Island Candlepin Pale Ale,12.39,4.8,1.0,Session IPA,United States,Independent Craft Brewer,4.4,32.0,No special notesbeer_updated,Unknown,Pint Glass,50.0,130.0,8.0,None
Cigar City Brewing Homemade Apple Pie Cider,11.99,5.0,1.0,Cider,United States,Craft,5.5,35.0,No special notesbeer_updated,Unknown,"Pint Glass, Snifter/Goblet/Chalice",50.0,130.0,8.0,Gluten Reduced
NOLA Irish Channel Stout,8.99,4.0,2.0,Stout,United States,Craft,6.8,35.0,No special notesbeer_updated,Unknown,"Pint Glass, Snifter/Goblet/Chalice",50.0,130.0,8.0,None
Prairie Christmas Bomb,9.49,4.8,1.0,Imperial Stout,United States,Craft,11.5,65.0,No special notesbeer_updated,Unknown,Snifter/Goblet/Chalice,50.0,130.0,8.0,None
Finnriver Sparkling Black Currant Cider,9.02,5.0,2.0,Cider,United States,Craft,6.5,35.0,No special notesbeer_updated,Unknown,"Pint Glass, Snifter/Goblet/Chalice",50.0,130.0,8.0,Gluten Reduced
Revival Night Swim'ah Belgian Wheat Ale,10.99,4.9,1.0,Wheat Ale,United States,Craft,4.7,35.0,No special notesbeer_updated,Unknown,Pint Glass,50.0,130.0,8.0,None
Cidergeist Semi Dry Hard Cider,10.99,3.0,2.0,Cider,United States,Craft,6.2,35.0,No special notesbeer_updated,Unknown,"Pint Glass, Snifter/Goblet/Chalice",50.0,130.0,8.0,Gluten Reduced
Great Lakes Seasonal,11.39,3.6,1.0,Seasonal Beer,United States,"Craft, Seasonal",4.0,35.0,No special notesbeer_updated,Unknown,"Pint Glass, Stein/Pub Mug, Snifter/Goblet/Chalice",49.0,130.0,8.0,None
Karbach Brewing Co. Greatest Hits Variety,18.11,5.0,2.0,Variety Pack Beer,United States,"Craft, Variety Pack",6.6,35.0,No special notesbeer_updated,Unknown,"Pint Glass, Stein/Pub Mug, Snifter/Goblet/Chalice",49.0,130.0,8.0,None
PRESS Premium Hard Seltzer Pomegranate Ginger,1.99,4.6,7.0,Hard Seltzer,United States,Independent Craft Brewer,4.0,35.0,No special notesbeer_updated,Unknown,Pint Glass,45.0,110.0,7.0,None
Crooked Stave Petite Sour Blueberry,7.99,5.0,1.0,Wild Ale,United States,Craft,5.0,10.0,No special notesbeer_updated,Unknown,Snifter/Goblet/Chalice,50.0,130.0,8.0,None
Evil Genius Purple Monkey Dishwasher Chocolate Peanut Butter Porter,56.99,4.3,3.0,Porter,United States,Independent Craft Brewer,6.7,35.0,No special notesbeer_updated,Unknown,"Pint Glass, Stein/Pub Mug",50.0,130.0,8.0,None
California Lager,30.95,5.0,1.0,Pale Lager,United States,Craft,4.9,35.0,No special notesbeer_updated,Unknown,Pint Glass,45.0,130.0,8.0,None
Castle Danger Pale Ale,10.99,4.7,1.0,American Pale Ale,United States,Independent Craft Brewer,5.2,35.0,"Balanced, Biscuit, Citrus, Grapefruit, Hoppy",Unknown,Pint Glass,50.0,130.0,8.0,None
Boulevard Love Child,19.99,3.8,2.0,Fruit Lambic,United States,Craft,9.0,7.0,No special notesbeer_updated,Unknown,Snifter/Goblet/Chalice,50.0,130.0,8.0,None
Stillwater Insetto Sour Ale,10.99,4.3,2.0,Sour / Wild Ale,United States,Craft,5.0,35.0,No special notesbeer_updated,Unknown,"Snifter/Goblet/Chalice, Stange",50.0,130.0,8.0,None
PNW Lager,7.99,5.0,1.0,Light Lager,United States,Craft,4.3,35.0,No special notesbeer_updated,Unknown,Pint Glass,40.0,130.0,8.0,None
Granville Island Lions Winter Ale,13.57,5.0,1.0,Winter Warmer,United States,Craft,5.5,35.0,No special notesbeer_updated,Unknown,Snifter/Goblet/Chalice,55.0,130.0,8.0,None
Vizzy Papaya Passionfruit Hard Seltzer,3.49,4.6,5.0,Hard Seltzer,United States,Craft,5.0,35.0,"Fruity, Light, Passionfruit",Unknown,Snifter/Goblet/Chalice,45.0,100.0,8.0,Gluten-Free
Two Robbers Watermelon and Cucumber,12.99,3.9,3.0,Hard Seltzer,United States,"Craft, Independent Craft Brewer",5.2,35.0,No special notesbeer_updated,Unknown,Snifter/Goblet/Chalice,45.0,110.0,8.0,Gluten-Free
Revolution DDH Galaxy IPA,15.99,3.0,2.0,IPA,United States,"Craft, Independent Craft Brewer",8.0,70.0,"Citrus, Hoppy",Unknown,Snifter/Goblet/Chalice,50.0,130.0,8.0,None
Mighty Squirrel Indulge Series: French Macaron,18.99,4.0,2.0,Stout,United States,Craft,8.0,35.0,No special notesbeer_updated,Unknown,Pint Glass,50.0,130.0,8.0,None
8th Wonder Brewery Cougar Paw Red Ale,10.38,5.0,1.0,Amber / Red Ale,United States,Craft,5.2,35.0,No special notesbeer_updated,Unknown,Pint Glass,50.0,130.0,8.0,None
Original Sin Cider Pineapple Haze,12.99,4.7,1.0,Cider,United States,Craft,6.0,35.0,No special notesbeer_updated,Unknown,Unknown,49.0,130.0,8.0,None
Batch 19 Pre-Prohibition Style Lager,18.54,5.0,1.0,American-Style Lager,United States,Craft,5.5,26.0,Crisp,Unknown,Pilsner Glass,40.0,174.0,15.0,None
Widowmaker Brewing Quarry Juice DIPA,19.99,5.0,1.0,Imperial / Double IPA,United States,Craft,8.0,35.0,No special notesbeer_updated,Unknown,Snifter/Goblet/Chalice,50.0,130.0,8.0,None
Epic Brewing Citra Lush New England IPA- Rotating Series,15.67,4.5,1.0,New England / Hazy IPA,United States,Seasonal,7.0,35.0,No special notesbeer_updated,Unknown,"Pint Glass, Snifter/Goblet/Chalice",50.0,130.0,8.0,None
Sauza Agua Fuerte Lime,10.49,4.9,16.0,Hard Seltzer,Mexico,Craft,5.0,35.0,No special notesbeer_updated,Unknown,Pint Glass,45.0,115.0,1.0,None
Boulevard Tequila Barrel Lime Gose,11.99,5.0,1.0,Gose,United States,Craft,4.2,11.0,No special notesbeer_updated,Unknown,Stange,45.0,130.0,8.0,None
